published,id,title,category,status,price,price_display,year,make,model,length_ft,hours,engine,hull,color,location,description,primary_image_url,gallery_urls,contact_phone,contact_email,created_at,condition,trailer_included,propulsion,beam_ft,draft_ft,fuel_capacity,seating_capacity,features,history,maintenance_notes
Y,oib-126925,2022 MOOMBA MOJO,Boat,available,86999,"$86,999",2022,Moomba,Mojo,23,91,INDMAR 6.2 RAPTOR 400,,,"Mooresville, North Carolina, 28115","The 2022 Moomba Mojo brings the ideal balance of power, space, and control to the 23-foot wake segment. Designed to keep everyone comfortable while producing top-tier surf and wake performance, this used Mojo delivers the same excitement and reliability that have made Moomba a go-to brand among families who love being on the water. With room for up to 17 people, it’s built for those weekends when everyone shows up ready to ride, lounge, and make memories on the lake. Under the deck, a 400-horsepower V-drive engine pairs with Moomba’s proven performance hull design, ensuring crisp handling and a clean, customizable wake. Whether you’re pulling up a first-time wakesurfer or dialing in a competitive wakeboard set, the Mojo has the ballast capacity, thrust, and precision you need. Its wide 8.5-foot beam creates extra stability and space, while the modest 2.3-foot draft keeps it nimble in shallow coves and marina waters. This particular Mojo from SouthTown Watersports in Charlotte, North Carolina, includes some valuable upgrades that make the difference during long summer days — a stern shade for extra cover at anchor, a Pro Tower for board storage and tow points, and a rear seat back kit that turns the cockpit into a social lounge. Underwater lighting sets the mood for evening cruises, while docking lights and a bow windscreen round out convenience and style for those late-day returns to the dock. From Lake Norman to Lake Wylie, this Mojo is equally at home delivering smooth surf sessions or just offering a comfortable spot to relax with friends. The combination of Moomba’s smart wake systems, reliable Indmar power, and passenger-friendly design makes this a standout in its class. SouthTown Watersports is known throughout the Carolinas for premium service, expert setup, and a genuine understanding of what wakesport families need. If you’re ready for a 23-foot wake boat that does it all — and does it with style — the 2022 Moomba Mojo is ready to make every set count.",https://onlyinboards.com/getmedia/48fc784a-dedc-425e-a3d3-3c728ee222e5/2022-moomba-mojo-126925-image0.webp,"https://onlyinboards.com/getmedia/48fc784a-dedc-425e-a3d3-3c728ee222e5/2022-moomba-mojo-126925-image0.webp,https://onlyinboards.com/getmedia/d1e7a47e-8580-4f5b-b498-7f65d038f165/2022-moomba-mojo-126925-image1.webp,https://onlyinboards.com/getmedia/916259f8-4df8-4169-9b3e-1717fca5244a/2022-moomba-mojo-126925-image2.webp,https://onlyinboards.com/getmedia/0edb9c35-5ce5-4041-9879-8667c0265a4f/2022-moomba-mojo-126925-image3.webp,https://onlyinboards.com/getmedia/99736a64-96bf-4872-b403-902cc437f036/2022-moomba-mojo-126925-image4.webp,https://onlyinboards.com/getmedia/689d2380-69d8-411a-977e-4547a0d47f2c/2022-moomba-mojo-126925-image5.webp,https://onlyinboards.com/getmedia/fe1c76d9-f00e-4566-9c19-4d42b3f26cff/2022-moomba-mojo-126925-image6.webp,https://onlyinboards.com/getmedia/e31c9bd4-e9d4-4d6e-90ab-ee5ff17b3b7f/2022-moomba-mojo-126925-image7.webp,https://onlyinboards.com/getmedia/a8c93756-9514-4b81-9349-608fd417431d/2022-moomba-mojo-126925-image8.webp,https://onlyinboards.com/getmedia/ab87f831-11d8-45e8-80a4-22babda30e14/2022-moomba-mojo-126925-image9.webp",704.957.0900,info@boatdudedeals.com,2026-04-06T01:32:34.429267+00:00,,,V-drive,,,,,,,
Y,oib-127756,2022 MALIBU M220,Boat,available,135999,"$135,999",2022,Malibu,M220,22,200,MALIBU M6DI,,,"Mooresville, North Carolina, 28115","2022 Malibu M220 • Extremely well kept • Still under Factory Warranty • Stored inside our warehouse • Never left on the water • Never been in salt water • Regularly serviced • Professionally detailed often This boat is incredible with a massive clean surf wave. It has given many good memories for our family & friends! Happy to schedule a time for you to look at it. Serious buyers only please. We have a Financing Contact available if you want to go that route we can connect you with them. Fun Facts: • 5 Year Transferrable Warranty • Wake View Seating • Cup Holders – Stainless • M220 Windblock Door • Swim Step • Stern Turn • Rack – Slide Off Spinner Combo • Malibu G5 Tower Black • Glove Box – Locking • Seat Bolster – Flip Up (Drivers) • Backup Camera • Power Lift Helm Seat and Swivel • Heater, 3-Outlet • Malibu Ice Box & Trash Can • Subwoofer – ONE 12 inch Subwoofer • Speakers – Wet Sounds Rev 10 • Sound System – M220 Pack • Wakeview Bench Seat w/IntegratedTable • CS Bimini Top – Gen II Surf • Mechanical Equipment • Engine: Malibu Monsoon M6Di, 404 HP • Ballast – Monitoring System (BMS) • Malibu Monsoon M6Di • Malibu Stern Turn • 170a Alternator • Ballast HI FLO – PNP Plumbing w/Auto Vent • Wideview Backup Camera • RGB Lighting System • Deck and Hull Equipment • Surf Gate w/Malibu Surfband • Wedge – Power Wedge III • Ski Tow Bar – Rear Grab Handle • Transom Lights – Underwater – Blue • Deck Trac – Nonskid (Complete Deck • Kit) • Soft-Grip Flooring • CS Boat Cover w/APS 3 • Docking Lights (Pair, LEDs) • Audio & Visual features • 5 Year Transferrable Warranty • Wake View Seating • Cup Holders – Stainless • M220 Windblock Door • Swim Step • Stern Turn • Rack – Slide Off Spinner Combo • Malibu G5 Tower Black • Glove Box – Locking • Seat Bolster – Flip Up (Drivers) • Backup Camera • Power Lift Helm Seat and Swivel • Heater, 3-Outlet • Malibu Ice Box & Trash Can • Subwoofer – ONE 12 inch Subwoofer • Speakers – Wet Sounds Rev 10 • Sound System – M220 Pack • Wakeview Bench Seat w/IntegratedTable • CS Bimini Top – Gen II Surf • Mechanical Equipment • Engine: Malibu Monsoon M6Di, 404 HP • Ballast – Monitoring System (BMS) • Malibu Monsoon M6Di • Malibu Stern Turn • 170a Alternator • Ballast HI FLO – PNP Plumbing w/Auto Vent • Wideview Backup Camera • RGB Lighting System • Deck and Hull Equipment • Surf Gate w/Malibu Surfband • Wedge – Power Wedge III • Ski Tow Bar – Rear Grab Handle • Transom Lights – Underwater – Blue • Deck Trac – Nonskid (Complete Deck • Kit) • Soft-Grip Flooring • CS Boat Cover w/APS 3 • Docking Lights (Pair, LEDs) • Audio & Visual features • Subwoofer: ONE 12 inch Subwoofer • Speakers: Wet Sounds Rev 10 • Sound System: M220 Pack • Transom Lights: Underwater – Blue • RGB Lighting System • Upgraded sound system • Watersports features: Malibu G5 Tower Black • Ski Tow Bar: Rear Grab Handle • Rear Pylon • Other features and upgrades: • Fully tinted windshield • Stern Tern • Trailer & Cove",https://onlyinboards.com/getmedia/42d8f7e4-6ac0-414f-9044-28dc4ca7e9e1/2022-malibu-m220-127756-image0.webp,"https://onlyinboards.com/getmedia/42d8f7e4-6ac0-414f-9044-28dc4ca7e9e1/2022-malibu-m220-127756-image0.webp,https://onlyinboards.com/getmedia/69fdee79-6b1a-4f72-b50a-d9d07db1990e/2022-malibu-m220-127756-image1.webp,https://onlyinboards.com/getmedia/93e594dc-0d37-4911-a836-952c0f00f728/2022-malibu-m220-127756-image2.webp,https://onlyinboards.com/getmedia/30144e13-a3bc-4f24-bb8c-f59e6298ea01/2022-malibu-m220-127756-image3.webp,https://onlyinboards.com/getmedia/d13587c8-5733-428f-b7b0-93e7c0655f92/2022-malibu-m220-127756-image4.webp,https://onlyinboards.com/getmedia/91f7b72f-0004-4942-83b7-db977473177e/2022-malibu-m220-127756-image5.webp,https://onlyinboards.com/getmedia/76c8e828-1b2c-40a5-9062-1b91399a2d30/2022-malibu-m220-127756-image6.webp,https://onlyinboards.com/getmedia/10057287-b4de-4f1e-8872-bdfb13a9e5fd/2022-malibu-m220-127756-image7.webp,https://onlyinboards.com/getmedia/302dbd88-5d94-42ff-835a-e7be29adf364/2022-malibu-m220-127756-image8.webp,https://onlyinboards.com/getmedia/6d4b4f21-8bc7-41ed-8a3c-525eaacbbba2/2022-malibu-m220-127756-image9.webp",704.957.0900,info@boatdudedeals.com,2026-04-06T01:32:35.079788+00:00,,,V-drive,,,,,,,
Y,oib-128141,2007 MALIBU V RIDE,Boat,available,24999,"$24,999",2007,Malibu,vRide,21,800,INDNAR 5.7,,,"Mooresville, North Carolina, 28115","Malibu V Ride is the model of choice when you are ready to elevate your riding skills, but not willing to deplete your budget. Standard features such as the Precision Pro Speed Control and a 500-pound Malibu Launch System for extra ballast guarantee you have the flexibility to expand your cache of tricks. Coupled with your choice of towers between the Malibu Illusion X and the optional Titan Series III it is clear Malibu understands your needs. Later, add the optional rear MLS, the Wedge, or its powered counterpart, to further expand wake enhancement",https://onlyinboards.com/getmedia/26d3fff6-1b45-4b65-8098-33539940ebc3/2007-malibu-vride-128141-image0.webp,"https://onlyinboards.com/getmedia/26d3fff6-1b45-4b65-8098-33539940ebc3/2007-malibu-vride-128141-image0.webp,https://onlyinboards.com/getmedia/79e659e8-e09f-4178-904e-f3913fe954b2/2007-malibu-vride-128141-image1.webp,https://onlyinboards.com/getmedia/bfe7da24-4c81-445a-86ea-e682833792b9/2007-malibu-vride-128141-image2.webp,https://onlyinboards.com/getmedia/244662e9-84c7-4029-9aaf-0e631dd20eca/2007-malibu-vride-128141-image3.webp,https://onlyinboards.com/getmedia/2ae11de7-d317-44e6-a688-0935c16b41db/2007-malibu-vride-128141-image4.webp,https://onlyinboards.com/getmedia/a6ea7655-d78d-460c-82e6-daf9609b5d7c/2007-malibu-vride-128141-image5.webp,https://onlyinboards.com/getmedia/633129ba-445d-4ba6-b096-bf5ce548a93a/2007-malibu-vride-128141-image6.webp,https://onlyinboards.com/getmedia/7cf167a6-8f6f-4245-ad68-f3875004af9f/2007-malibu-vride-128141-image7.webp,https://onlyinboards.com/getmedia/030d35d8-f91e-46b8-83d2-88d6f2bc3afb/2007-malibu-vride-128141-image8.webp,https://onlyinboards.com/getmedia/94660bb0-38c7-47fd-83cc-c0de8548c1cb/2007-malibu-vride-128141-image9.webp",704.957.0900,info@boatdudedeals.com,2026-04-06T01:32:35.702232+00:00,,,V-drive,,,,,,,
Y,po-25516,New Premier 230 Intrique RF 2024 – Black / Graphite,Boat,available,65999,"$65,999",2024,Premier,230 Intrique RF,23,,200+,,,"Cornelius, NC","2024 Premier Intrigue 230 RF with Suzuki Precision Control 250HP Engine The 2024 Premier Intrigue 230 RF is a masterful blend of style and performance, engineered for the discerning boater. Equipped with the reliable and powerful Suzuki Precision Control 250 HP engine, this vessel is designed to deliver a smooth and responsive boating experience. The Premier Pontoons brand is synonymous with luxury and bleeding edge technology, making sure that you get the absolute most out of your boat to make lasting memories on the water. Performance The Suzuki Precision Control 250HP Engine provides a blend of power and efficiency. The engine’s digital controls ensure smooth acceleration and handling, allowing for a seamless boating experience for both the drivers and passengers. Luxury & Comfort When it comes to comfort and luxury features, Premier knocked it out of the park with the Intrigue model. The Premier Intrigue pontoon is loaded to the brim with tons of premium features and luxurious seating options. In addition, the wraparound seating layout on the RF floorpan provides extremely versatile seating options to make sure every passenger is comfortable, even for those long rides down the lake. Durability & Maintenance Premier Pontoons has a rather simple yet effective Moto, that is Over Built, to Over Deliver. They put this ideal into every boat they build to ensure their boats will survive the harsh marine environment for decades to come. In addition to superior craftsmanship when it comes to the boat itself, the engine is just as reliable thanks to the quality and care from Suzuki Marine. For more information about this specific unit, or to see it in action, send us a message or come and check it out at our facility in Cornelius, North Carolina. #boatdudedeals",https://www.pontoonsonly.com/App_Themes/PontoonsOnly/Photo/20981595.jpeg,"https://www.pontoonsonly.com/App_Themes/PontoonsOnly/Photo/20981595.jpeg,https://www.pontoonsonly.com/App_Themes/PontoonsOnly/Photo/20981596.jpeg,https://www.pontoonsonly.com/App_Themes/PontoonsOnly/Photo/20981597.jpeg,https://www.pontoonsonly.com/App_Themes/PontoonsOnly/Photo/20981598.jpeg,https://www.pontoonsonly.com/App_Themes/PontoonsOnly/Photo/20981599.jpeg,https://www.pontoonsonly.com/App_Themes/PontoonsOnly/Photo/20981600.jpeg,https://www.pontoonsonly.com/App_Themes/PontoonsOnly/Photo/20981601.jpeg,https://www.pontoonsonly.com/App_Themes/PontoonsOnly/Photo/20981602.jpeg,https://www.pontoonsonly.com/App_Themes/PontoonsOnly/Photo/20981603.jpeg",704.957.0900,info@boatdudedeals.com,2026-04-06T01:32:36.369274+00:00,,,,,,,,,,
Y,po-25517,New Premier Sunsation 230 RL 2024 – Pearl White,Boat,available,48999,"$48,999",2024,Premier,Sunsation 230 RL,23,,101-150,,,"Cornelius, NC","Luxury, Comfort, and Endless Fun! The Premier Sunsation Pontoon seamlessly blends exceptional performance with unparalleled luxury, ensuring every outing is an unforgettable adventure. Whether you’re cruising on tranquil waters, entertaining friends, or indulging in watersports, the Sunsation Pontoon is designed to elevate your boating experience to new heights. Elegant Design and Spacious Layout: The Sunsation's eye-catching design and thoughtful layout maximize space and comfort. Plush seating, abundant storage, and a variety of seating configurations provide the perfect setting for relaxation and socializing. The high-quality materials and meticulous craftsmanship ensure lasting durability and aesthetic appeal. Powered By Suzuki for Top-Tier Performance: Powered by a robust Suzuki engine with Mechanical Controls, the Sunsation delivers smooth, reliable performance in any conditions. The expertly engineered hull provides stability and maneuverability, ensuring a safe and enjoyable ride. Whether you're at the helm or relaxing onboard, you can trust in the Sunsation's exceptional handling and performance. A Boat for All Occasions: Whether you're embarking on a peaceful fishing trip, hosting a lively gathering, or enjoying watersports, the Premier Sunsation Pontoon is versatile enough to accommodate all your boating needs. Discover the perfect blend of performance, luxury, and fun with the Premier Sunsation Pontoon! For more information about this specific Premier Sunsation, send us a message or stop by our showroom. Full Options List + Bimini Frame Color + Canvas Color + Electronics & Lighting Options + Engine + Engine Pre-Rig + Exterior Options + Fiberglass Helm Color + Flooring Color + Furniture Accent Color + Furniture Base Color + Graphics + Panel Color + Rail Color + Vantage Tube Film #boatdudedeals",https://www.pontoonsonly.com/App_Themes/PontoonsOnly/Photo/20981604.jpeg,"https://www.pontoonsonly.com/App_Themes/PontoonsOnly/Photo/20981604.jpeg,https://www.pontoonsonly.com/App_Themes/PontoonsOnly/Photo/20981605.jpeg,https://www.pontoonsonly.com/App_Themes/PontoonsOnly/Photo/20981606.jpeg,https://www.pontoonsonly.com/App_Themes/PontoonsOnly/Photo/20981607.jpeg,https://www.pontoonsonly.com/App_Themes/PontoonsOnly/Photo/20981608.jpeg,https://www.pontoonsonly.com/App_Themes/PontoonsOnly/Photo/20981609.jpeg,https://www.pontoonsonly.com/App_Themes/PontoonsOnly/Photo/20981610.jpeg,https://www.pontoonsonly.com/App_Themes/PontoonsOnly/Photo/20981611.jpeg,https://www.pontoonsonly.com/App_Themes/PontoonsOnly/Photo/20981612.jpeg",704.957.0900,info@boatdudedeals.com,2026-04-06T01:32:36.958248+00:00,,,,,,,,,,
Y,po-25518,New Premier Sunsation 230 RF 2024 – Graphite / Black,Boat,available,48999,"$48,999",2024,Premier,Sunsation 230 RF,23,,101-150,,,"Cornelius, NC","Luxury, Comfort, and Endless Fun! The Premier Sunsation Pontoon seamlessly blends exceptional performance with unparalleled luxury, ensuring every outing is an unforgettable adventure. Whether you’re cruising on tranquil waters, entertaining friends, or indulging in watersports, the Sunsation Pontoon is designed to elevate your boating experience to new heights. Elegant Design and Spacious Layout: The Sunsation's eye-catching design and thoughtful layout maximize space and comfort. Plush seating, abundant storage, and a variety of seating configurations provide the perfect setting for relaxation and socializing. The high-quality materials and meticulous craftsmanship ensure lasting durability and aesthetic appeal. Powered By Suzuki for Top-Tier Performance: Powered by a robust Suzuki engine with Mechanical Controls, the Sunsation delivers smooth, reliable performance in any conditions. The expertly engineered hull provides stability and maneuverability, ensuring a safe and enjoyable ride. Whether you're at the helm or relaxing onboard, you can trust in the Sunsation's exceptional handling and performance. A Boat for All Occasions: Whether you're embarking on a peaceful fishing trip, hosting a lively gathering, or enjoying watersports, the Premier Sunsation Pontoon is versatile enough to accommodate all your boating needs. Discover the perfect blend of performance, luxury, and fun with the Premier Sunsation Pontoon! For more information about this specific Premier Sunsation, send us a message or stop by our showroom. Full Options List + Bimini Frame Color + Canvas Color + Dealer Options + Electronics & Lighting Options + Engine + Engine Pre-Rig + Exterior Options + Fiberglass Helm Color + Flooring Color + Furniture Accent Color + Furniture Base Color + Graphics + Panel Color + Rail Color #boatdudedeals",https://www.pontoonsonly.com/App_Themes/PontoonsOnly/Photo/20981613.jpeg,"https://www.pontoonsonly.com/App_Themes/PontoonsOnly/Photo/20981613.jpeg,https://www.pontoonsonly.com/App_Themes/PontoonsOnly/Photo/20981614.jpeg,https://www.pontoonsonly.com/App_Themes/PontoonsOnly/Photo/20981615.jpeg,https://www.pontoonsonly.com/App_Themes/PontoonsOnly/Photo/20981616.jpeg,https://www.pontoonsonly.com/App_Themes/PontoonsOnly/Photo/20981617.jpeg,https://www.pontoonsonly.com/App_Themes/PontoonsOnly/Photo/20981618.jpeg,https://www.pontoonsonly.com/App_Themes/PontoonsOnly/Photo/20981619.jpeg,https://www.pontoonsonly.com/App_Themes/PontoonsOnly/Photo/20981620.jpeg,https://www.pontoonsonly.com/App_Themes/PontoonsOnly/Photo/20981621.jpeg",704.957.0900,info@boatdudedeals.com,2026-04-06T01:32:37.556219+00:00,,,,,,,,,,
Y,po-25519,New Premier 230 Sunsation RL 2024 – Crimson Red / Black,Boat,available,48999,"$48,999",2024,Premier,230 Sunsation RL,23,,101-150,,,"Cornelius, NC","Luxury, Comfort, and Endless Fun! The Premier Sunsation Pontoon seamlessly blends exceptional performance with unparalleled luxury, ensuring every outing is an unforgettable adventure. Whether you’re cruising on tranquil waters, entertaining friends, or indulging in watersports, the Sunsation Pontoon is designed to elevate your boating experience to new heights. Elegant Design and Spacious Layout: The Sunsation's eye-catching design and thoughtful layout maximize space and comfort. Plush seating, abundant storage, and a variety of seating configurations provide the perfect setting for relaxation and socializing. The high-quality materials and meticulous craftsmanship ensure lasting durability and aesthetic appeal. Powered By Suzuki for Top-Tier Performance: Powered by a robust Suzuki engine with Mechanical Controls, the Sunsation delivers smooth, reliable performance in any conditions. The expertly engineered hull provides stability and maneuverability, ensuring a safe and enjoyable ride. Whether you're at the helm or relaxing onboard, you can trust in the Sunsation's exceptional handling and performance. A Boat for All Occasions: Whether you're embarking on a peaceful fishing trip, hosting a lively gathering, or enjoying watersports, the Premier Sunsation Pontoon is versatile enough to accommodate all your boating needs. Discover the perfect blend of performance, luxury, and fun with the Premier Sunsation Pontoon! For more information about this specific Premier Sunsation, send us a message or stop by our showroom. #boatdudedeals",https://www.pontoonsonly.com/App_Themes/PontoonsOnly/Photo/20981622.jpeg,"https://www.pontoonsonly.com/App_Themes/PontoonsOnly/Photo/20981622.jpeg,https://www.pontoonsonly.com/App_Themes/PontoonsOnly/Photo/20981623.jpeg",704.957.0900,info@boatdudedeals.com,2026-04-06T01:32:38.093807+00:00,,,,,,,,,,
Y,po-25520,New Xcursion RFX 243 2023 – Graphite Metallic / Frost White,Boat,available,67999,"$67,999",2023,Xcursion,RFX 243,24,,200+,,,"Cornelius, NC","The Xcursion 243 RFX is great for larger crews who want to make the most out of their time on the water. The RFX line of boats feature wrap-around style seating in both the front and rear of the boat, this allows for more people to sit comfortably in the boat. Additionally, the 243 RFX has an extended rear swim platform to allow easy movement around the engine and quick access both to and from the ladder. This specific Xcursion 243 RFX is loaded to the brim with options to make your time on the water even more enjoyable. To kick things off, this boat is equipped with Xcursion’s Deluxe Package upgrade which gives you a raised helm, premium steering wheel, flip-up cleats, 2 subwoofers, and a black acrylic table. Additionally, this boat is equipped with RGB back-list speakers, under deck lighting, under helm lighting, and much more. Powering this gorgeous all-black boat is a powerful Mercury 225 HP Outboard. This 225 HP engine is extremely powerful and makes getting around the lake far more enjoyable! What sets Xcursion Pontoons apart from their competitors? To kick things off, Xcursion Pontoons believe that high quality with exceptional durability is the only way to build a pontoon. Each pontoon features a fully welded C-Channel bow and extended swim deck along with full-length interior risers. This helps increase ride quality by eliminating unwanted flex. As for the construction of the actual pontoons, Xcursion also uses extruded splash fins to prevent unwanted spray along with a reinforced power keel to provide better tracking and more protection to the pontoons when being beached. #boatdudedeals",https://www.pontoonsonly.com/App_Themes/PontoonsOnly/Photo/20981624.jpeg,"https://www.pontoonsonly.com/App_Themes/PontoonsOnly/Photo/20981624.jpeg,https://www.pontoonsonly.com/App_Themes/PontoonsOnly/Photo/20981625.jpeg,https://www.pontoonsonly.com/App_Themes/PontoonsOnly/Photo/20981626.jpeg,https://www.pontoonsonly.com/App_Themes/PontoonsOnly/Photo/20981627.jpeg,https://www.pontoonsonly.com/App_Themes/PontoonsOnly/Photo/20981628.jpeg,https://www.pontoonsonly.com/App_Themes/PontoonsOnly/Photo/20981629.jpeg,https://www.pontoonsonly.com/App_Themes/PontoonsOnly/Photo/20981630.jpeg,https://www.pontoonsonly.com/App_Themes/PontoonsOnly/Photo/20981631.jpeg,https://www.pontoonsonly.com/App_Themes/PontoonsOnly/Photo/20981632.jpeg",704.957.0900,info@boatdudedeals.com,2026-04-06T01:32:38.698595+00:00,,,,,,,,,,
Y,po-25521,New Xcursion FLX 243 2023 – Navy Metallic / Diamond Ice Metallic,Boat,available,62999,"$62,999",2023,Xcursion,FLX 243,24,,200+,,,"Cornelius, NC","The Xcursion 243 FLX is great for those who not only enjoy cruising around the lake, but also enjoy soaking up the sun while hanging out at the sandbar or anchored in a cove. The FLX line of boats feature a rear day-bed that allows for tons of space to lay out and catch some sun both while underway and while anchored. The day-bed also has 2 separate adjustable backrest to provide you with multiple seating options to best suit you and your crew. This specific Xcursion 243 FLX features the gray furniture package with the woven tapestry flooring. This boat is also equipped with the HP Triple Tune upgrade which provides increased stability while underway. Powering this gorgeous black metallic boat is a 225 HP Mercury. This engine is extremely powerful and makes getting around the lake far more enjoyable! What sets Xcursion Pontoons apart from their competitors? To kick things off, Xcursion Pontoons believe that high quality with exceptional durability is the only way to build a pontoon. Each pontoon features a fully welded C-Channel bow and extended swim deck along with full-length interior risers. This helps increase ride quality by eliminating unwanted flex. As for the construction of the actual pontoons, Xcursion also uses extruded splash fins to prevent unwanted spray along with a reinforced power keel to provide better tracking and more protection to the pontoons when being beached. #boatdudedeals",https://www.pontoonsonly.com/App_Themes/PontoonsOnly/Photo/20981633.jpeg,"https://www.pontoonsonly.com/App_Themes/PontoonsOnly/Photo/20981633.jpeg,https://www.pontoonsonly.com/App_Themes/PontoonsOnly/Photo/20981634.jpeg,https://www.pontoonsonly.com/App_Themes/PontoonsOnly/Photo/20981635.jpeg,https://www.pontoonsonly.com/App_Themes/PontoonsOnly/Photo/20981636.jpeg,https://www.pontoonsonly.com/App_Themes/PontoonsOnly/Photo/20981637.jpeg,https://www.pontoonsonly.com/App_Themes/PontoonsOnly/Photo/20981638.jpeg,https://www.pontoonsonly.com/App_Themes/PontoonsOnly/Photo/20981639.jpeg,https://www.pontoonsonly.com/App_Themes/PontoonsOnly/Photo/20981640.jpeg",704.957.0900,info@boatdudedeals.com,2026-04-06T01:32:39.293439+00:00,,,,,,,,,,
