published,id,title,category,status,price,price_display,year,make,model,length_ft,hours,engine,hull,color,location,description,primary_image_url,gallery_urls,contact_phone,contact_email,created_at,condition,trailer_included,propulsion,beam_ft,draft_ft,fuel_capacity,seating_capacity,features,history,maintenance_notes
Y,po-25522,New Xcursion PFX 243 2023 – Navy Metallic / White Frost Metallic,Boat,available,57999,"$57,999",2023,Xcursion,PFX 243,24,,151-200,,,"Cornelius, NC","he Xcursion 243 PFX is great for those who enjoy dropping a line in the water to fish your favorite spot. However, don't confuse this Xcursion PFX with your conventional fishing pontoon, with this boat you don't sacrifice luxury to get the features you want. The PFX includes a wrap-around seating configuration in the bow and dual adjustable captains chairs towards the rear with easy access to rod storage, rod holders, and the live well. Powering this gorgeous navy and white metallic boat is a 200 HP Honda. This engine is extremely powerful and makes getting around the lake far more enjoyable! What sets Xcursion Pontoons apart from their competitors? To kick things off, Xcursion Pontoons believe that high quality with exceptional durability is the only way to build a pontoon. Each pontoon features a fully welded C-Channel bow and extended swim deck along with full-length interior risers. This helps increase ride quality by eliminating unwanted flex. As for the construction of the actual pontoons, Xcursion also uses extruded splash fins to prevent unwanted spray along with a reinforced power keel to provide better tracking and more protection to the pontoons when being beached. #boatdudedeals",https://www.pontoonsonly.com/App_Themes/PontoonsOnly/Photo/20981642.jpeg,"https://www.pontoonsonly.com/App_Themes/PontoonsOnly/Photo/20981642.jpeg,https://www.pontoonsonly.com/App_Themes/PontoonsOnly/Photo/20981643.jpeg,https://www.pontoonsonly.com/App_Themes/PontoonsOnly/Photo/20981644.jpeg,https://www.pontoonsonly.com/App_Themes/PontoonsOnly/Photo/20981645.jpeg,https://www.pontoonsonly.com/App_Themes/PontoonsOnly/Photo/20981646.jpeg,https://www.pontoonsonly.com/App_Themes/PontoonsOnly/Photo/20981649.jpeg,https://www.pontoonsonly.com/App_Themes/PontoonsOnly/Photo/20981651.jpeg,https://www.pontoonsonly.com/App_Themes/PontoonsOnly/Photo/20981652.jpeg,https://www.pontoonsonly.com/App_Themes/PontoonsOnly/Photo/20981654.jpeg",704.957.0900,info@boatdudedeals.com,2026-04-06T01:32:39.901778+00:00,,,,,,,,,,
Y,po-25523,New Coach RFC 263 2023 – Black Metallic,Boat,available,65999,"$65,999",2023,Coach,RFC 263,26,,200+,,,"Cornelius, NC","The Coach 263 RFC is great for larger crews who want to make the most out of their time on the water. The RFC line of boats feature wrap-around style seating in both the front and rear of the boat, this allows for more people to sit comfortably in the boat. Additionally, the 263 RFC has an extended rear swim platform to allow easy movement around the engine and quick access both to and from the ladder. This specific Coach 263 RFC is loaded to the brim with options to make your time on the water even more enjoyable. To kick things off, this boat is equipped with Coach’s Deluxe Package upgrade which gives you a raised helm, premium steering wheel, flip-up cleats, 2 subwoofers, and a black acrylic table. Additionally, this boat is equipped with RGB back-list speakers, under deck lighting, under helm lighting, and much more. Powering this gorgeous all-black boat is a powerful Honda 250 DXDA. This 250 HP engine is extremely powerful and makes getting around the lake far more enjoyable! What sets Coach Pontoons apart from their competitors? To kick things off, Coach Pontoons believe that high quality with exceptional durability is the only way to build a pontoon. Each pontoon features a fully welded C-Channel bow and extended swim deck along with full-length interior risers. This helps increase ride quality by eliminating unwanted flex. As for the construction of the actual pontoons, Coach also uses extruded splash fins to prevent unwanted spray along with a reinforced power keel to provide better tracking and more protection to the pontoons when being beached. #boatdudedeals",https://www.pontoonsonly.com/App_Themes/PontoonsOnly/Photo/20981655.jpeg,"https://www.pontoonsonly.com/App_Themes/PontoonsOnly/Photo/20981655.jpeg,https://www.pontoonsonly.com/App_Themes/PontoonsOnly/Photo/20981656.jpeg,https://www.pontoonsonly.com/App_Themes/PontoonsOnly/Photo/20981657.jpeg,https://www.pontoonsonly.com/App_Themes/PontoonsOnly/Photo/20981658.jpeg,https://www.pontoonsonly.com/App_Themes/PontoonsOnly/Photo/20981659.jpeg,https://www.pontoonsonly.com/App_Themes/PontoonsOnly/Photo/20981660.jpeg",704.957.0900,info@boatdudedeals.com,2026-04-06T01:32:40.508408+00:00,,,,,,,,,,
Y,po-25524,New Coach FLC 243 2023 – Graphite Metallic,Boat,available,61999,"$61,999",2023,Coach,FLC 243,24,,200+,,,"Cornelius, NC","The Coach 243 FLC is great for those who not only enjoy cruising around the lake, but also enjoy soaking up the sun while hanging out at the sandbar or anchored in a cove. The FLC line of boats feature a rear day-bed that allows for tons of space to lay out and catch some sun both while underway and while anchored. The day-bed also has 2 separate adjustable backrest to provide you with multiple seating options to best suit you and your crew. This specific Coach 243 FLC features the stone furniture package with the woven tapestry flooring. Additionally, this boat features a raised helm, RGB lighting, premium steering wheel, and Bazooka bass tube. This boat is also equipped with the HP Triple Tune upgrade which provides increased stability while underway. Powering this gorgeous graphite metallic boat is a 225 HP Honda. This engine is extremely powerful and makes getting around the lake far more enjoyable! What sets Coach Pontoons apart from their competitors? To kick things off, Coach Pontoons believe that high quality with exceptional durability is the only way to build a pontoon. Each pontoon features a fully welded C-Channel bow and extended swim deck along with full-length interior risers. This helps increase ride quality by eliminating unwanted flex. As for the construction of the actual pontoons, Coach also uses extruded splash fins to prevent unwanted spray along with a reinforced power keel to provide better tracking and more protection to the pontoons when being beached. Financing and delivery available!! Lake Norman, Lake Wylie, Badin, High Rock, Keowee, Hartwell, James, Mtn Island, discount, Indmar, Tillery, Surf, Watersports, wakeboard, georgia, tennessee, south carolina WILL SHIP ANYWHERE IN THE US #boatdudedeals",https://www.pontoonsonly.com/App_Themes/PontoonsOnly/Photo/20981661.jpeg,"https://www.pontoonsonly.com/App_Themes/PontoonsOnly/Photo/20981661.jpeg,https://www.pontoonsonly.com/App_Themes/PontoonsOnly/Photo/20981662.jpeg,https://www.pontoonsonly.com/App_Themes/PontoonsOnly/Photo/20981663.jpeg,https://www.pontoonsonly.com/App_Themes/PontoonsOnly/Photo/20981664.jpeg,https://www.pontoonsonly.com/App_Themes/PontoonsOnly/Photo/20981665.jpeg,https://www.pontoonsonly.com/App_Themes/PontoonsOnly/Photo/20981666.jpeg,https://www.pontoonsonly.com/App_Themes/PontoonsOnly/Photo/20981667.jpeg,https://www.pontoonsonly.com/App_Themes/PontoonsOnly/Photo/20981668.jpeg,https://www.pontoonsonly.com/App_Themes/PontoonsOnly/Photo/20981669.jpeg",704.957.0900,info@boatdudedeals.com,2026-04-06T01:32:41.203211+00:00,,,,,,,,,,
Y,po-25525,New Coach FLC 243 2023 – Black Metallic / Bronze Metallic,Boat,available,56999,"$56,999",2023,Coach,FLC 243,24,,151-200,,,"Cornelius, NC","NEW MUST GO BLOW OUT 20K UNDER INVOICE. WILL SHIP ANYWHERE IS THE US Financing and delivery available!! Lake Norman, Lake Wylie, Badin, High Rock, Keowee, Hartwell, James, Mtn Island, discount, Indmar, Tillery, Surf, Watersports, wakeboard, georgia, tennessee, south carolina The Coach 243 FLC is great for those who not only enjoy cruising around the lake, but also enjoy soaking up the sun while hanging out at the sandbar or anchored in a cove. The FLC line of boats feature a rear day-bed that allows for tons of space to lay out and catch some sun both while underway and while anchored. The day-bed also has 2 separate adjustable backrest to provide you with multiple seating options to best suit you and your crew. This specific Coach 243 FLC features the tan furniture package along with the woven tapestry flooring. This boat is also equipped with the HP Triple Tune upgrade which provides increased stability while underway. Powering this gorgeous Bronze & Black boat is a Mercury 175 XL FourStroke. This engine is extremely powerful and makes getting around the lake far more enjoyable! What sets Coach Pontoons apart from their competitors? To kick things off, Coach Pontoons believe that high quality with exceptional durability is the only way to build a pontoon. Each pontoon features a fully welded C-Channel bow and extended swim deck along with full-length interior risers. This helps increase ride quality by eliminating unwanted flex. As for the construction of the actual pontoons, Coach also uses extruded splash fins to prevent unwanted spray along with a reinforced power keel to provide better tracking and more protection to the pontoons when being beached. #boatdudedeals",https://www.pontoonsonly.com/App_Themes/PontoonsOnly/Photo/20981670.jpeg,"https://www.pontoonsonly.com/App_Themes/PontoonsOnly/Photo/20981670.jpeg,https://www.pontoonsonly.com/App_Themes/PontoonsOnly/Photo/21420628.jpeg,https://www.pontoonsonly.com/App_Themes/PontoonsOnly/Photo/21420630.jpeg,https://www.pontoonsonly.com/App_Themes/PontoonsOnly/Photo/21420632.jpeg,https://www.pontoonsonly.com/App_Themes/PontoonsOnly/Photo/21420633.jpeg,https://www.pontoonsonly.com/App_Themes/PontoonsOnly/Photo/21420634.jpeg,https://www.pontoonsonly.com/App_Themes/PontoonsOnly/Photo/21420635.jpeg",704.957.0900,info@boatdudedeals.com,2026-04-06T01:32:41.856219+00:00,,,,,,,,,,
Y,po-25526,New Coach RFC 243 2023 – Black / Graphite Metallic,Boat,available,67999,"$67,999",2023,Coach,RFC 243,24,,200+,,,"Cornelius, NC","The Coach 243 RFC is great for larger crews who want to make the most out of their time on the water. The RFC line of boats feature wrap-around style seating in both the front and rear of the boat, this allows for more people to sit comfortably in the boat. Additionally, the 243 RFC has an extended rear swim platform to allow easy movement around the engine and quick access both to and from the ladder. This specific Coach 243 RFC is loaded to the brim with options to make your time on the water even more enjoyable. To kick things off, this boat is equipped with Coach’s Deluxe Package upgrade which gives you a raised helm, premium steering wheel, flip-up cleats, 2 subwoofers, and a black acrylic table. Additionally, this boat is equipped with RGB back-lit speakers and much more. Powering this gorgeous black and graphite metallic boat is a powerful Honda 225 DXDA. This 225 HP engine is extremely powerful and makes getting around the lake far more enjoyable! What sets Coach Pontoons apart from their competitors? To kick things off, Coach Pontoons believe that high quality with exceptional durability is the only way to build a pontoon. Each pontoon features a fully welded C-Channel bow and extended swim deck along with full-length interior risers. This helps increase ride quality by eliminating unwanted flex. As for the construction of the actual pontoons, Coach also uses extruded splash fins to prevent unwanted spray along with a reinforced power keel to provide better tracking and more protection to the pontoons when being beached. #boatdudedeals",https://www.pontoonsonly.com/App_Themes/PontoonsOnly/Photo/20981671.jpeg,"https://www.pontoonsonly.com/App_Themes/PontoonsOnly/Photo/20981671.jpeg,https://www.pontoonsonly.com/App_Themes/PontoonsOnly/Photo/20981672.jpeg,https://www.pontoonsonly.com/App_Themes/PontoonsOnly/Photo/20981673.jpeg,https://www.pontoonsonly.com/App_Themes/PontoonsOnly/Photo/20981674.jpeg,https://www.pontoonsonly.com/App_Themes/PontoonsOnly/Photo/20981675.jpeg,https://www.pontoonsonly.com/App_Themes/PontoonsOnly/Photo/20981676.jpeg,https://www.pontoonsonly.com/App_Themes/PontoonsOnly/Photo/20981677.jpeg,https://www.pontoonsonly.com/App_Themes/PontoonsOnly/Photo/20981678.jpeg",704.957.0900,info@boatdudedeals.com,2026-04-06T01:32:42.487003+00:00,,,,,,,,,,
Y,po-25527,New Coach FLC 243 2023 – Nautical Blue / White,Boat,available,64999,"$64,999",2023,Coach,FLC 243,24,,151-200,,,"Cornelius, NC","The Coach 243 FLC is great for those who not only enjoy cruising around the lake, but also enjoy soaking up the sun while hanging out at the sandbar or anchored in a cove. The FLC line of boats feature a rear day-bed that allows for tons of space to lay out and catch some sun both while underway and while anchored. The day-bed also has 2 separate adjustable backrest to provide you with multiple seating options to best suit you and your crew. This specific Coach 243 FLC features the gray furniture package with the woven tapestry flooring. This boat is also equipped with the HP Triple Tune upgrade which provides increased stability while underway. Powering this gorgeous black metallic boat is a 200 HP Honda. This engine is extremely powerful and makes getting around the lake far more enjoyable! What sets Coach Pontoons apart from their competitors? To kick things off, Coach Pontoons believe that high quality with exceptional durability is the only way to build a pontoon. Each pontoon features a fully welded C-Channel bow and extended swim deck along with full-length interior risers. This helps increase ride quality by eliminating unwanted flex. As for the construction of the actual pontoons, Coach also uses extruded splash fins to prevent unwanted spray along with a reinforced power keel to provide better tracking and more protection to the pontoons when being beached. #boatdudedeals",https://www.pontoonsonly.com/App_Themes/PontoonsOnly/Photo/20981679.jpeg,https://www.pontoonsonly.com/App_Themes/PontoonsOnly/Photo/20981679.jpeg,704.957.0900,info@boatdudedeals.com,2026-04-06T01:32:43.045518+00:00,,,,,,,,,,
