published,id,title,category,status,price,price_display,year,make,model,length_ft,hours,engine,hull,color,location,description,primary_image_url,gallery_urls,contact_phone,contact_email,created_at,condition,trailer_included,propulsion,beam_ft,draft_ft,fuel_capacity,seating_capacity,features,history,maintenance_notes
Y,oib-115962,2025 MOOMBA TYKON,Boat,available,113999,"$113,999",2025,Moomba,Tykon,24,0,INDMAR 6.2 RAPTOR 400,,,"CORNELIUS , North Carolina, 28031","2025 Moomba Tykon 2025 Moomba Tykon – Big Waves, Bigger Adventures! If you’re looking for a wakeboat that does it all, the 2025 Moomba Tykon is built to take your on-water experience to the next level. At 24 fet long with seating for up to 18 people, this boat has tons of space for family, friends, and all the gear you need for a perfect day on the water! financing and delivery available!! Lake Norman, Lake Wylie, Badin, High Rock, Keowee, Hartwell, James, Mtn Island, discount, Indmar, Tillery, Surf, Watersports, wakeboard, georgia, tennessee, south carolina Key Features of the Moomba Tykon Innovative Design: The Tykon boasts a versatile layout, accommodating both high performance watersports and leisurely cruises. Advanced Technology: Equipped with the latest advancements, including the E/Pex Tower and dual screens, ensuring a user-friendly experience! Powerful Performance: Powered by the Indmar Raptor 6.2L 450 engine, delivering 430 horsepower for exhilarating speeds and smooth cruising. Spacious Capacity:With a length of 24. Feet and a beam of 102 inches, the Tykon provides ample space for up to 18 passengers, making it ideal for larger groups or families. Premium Boat without the Premium Price? This boat is all about comfort, style, and fun, with plush seating, a killer sound system, and premium storage for all your gear! Whether you’re pushing your limits or just relaxing on the water, the Moomba Tykon is built to handle it all-without breaking the bank! Ready to Turn Heads on the Water? If you're ready to elevate your watersports game, don’t wait! Contact us today to schedule a viewing or get more information about this incredible boat. The 2025 Moomba Max is waiting for you! Call now and secure your dream boat before it's gone!",https://onlyinboards.com/getmedia/5b76bbc8-4373-491d-9701-2ece718a1ef9/2025-moomba-tykon-115962-image0.webp,"https://onlyinboards.com/getmedia/5b76bbc8-4373-491d-9701-2ece718a1ef9/2025-moomba-tykon-115962-image0.webp,https://onlyinboards.com/getmedia/3ad9e250-083c-409a-a0b5-0830bcbcdc92/2025-moomba-tykon-115962-image1.webp,https://onlyinboards.com/getmedia/582c3b5c-9517-410f-beca-361f6be178f9/2025-moomba-tykon-115962-image2.webp,https://onlyinboards.com/getmedia/cf1e0487-5ca9-411a-b885-c85580eee636/2025-moomba-tykon-115962-image3.webp,https://onlyinboards.com/getmedia/91ac5edb-b669-4d06-9a72-a39d67b8dcbb/2025-moomba-tykon-115962-image4.webp,https://onlyinboards.com/getmedia/8ee0bfa5-1a52-4511-84cd-f0a4e92229a5/2025-moomba-tykon-115962-image5.webp,https://onlyinboards.com/getmedia/0b6e477d-7685-49fb-92aa-69fb31d7ff6b/2025-moomba-tykon-115962-image6.webp,https://onlyinboards.com/getmedia/3cb635a4-9ee7-40dc-9266-1ef31d9de585/2025-moomba-tykon-115962-image7.webp,https://onlyinboards.com/getmedia/5389e44e-db4d-4908-bccd-f250d51101a2/2025-moomba-tykon-115962-image8.webp,https://onlyinboards.com/getmedia/ce2473a0-b46c-4ee2-aba0-843fa43d50b5/2025-moomba-tykon-115962-image9.webp",704.957.0900,info@boatdudedeals.com,2026-04-06T01:32:30.019474+00:00,,,V-drive,,,,,,,
Y,oib-115963,2025 MOOMBA MOJO,Boat,available,108995,"$108,995",2025,Moomba,Mojo,23,0,INDMAR 6.2 RAPTOR 400,,,"CORNELIUS , North Carolina, 28031","2025 Moomba Mojo: The Ultimate Wake Boat Experience Discover the Thrill of the 2025 Moomba Mojo Embark on an unparalleled water adventure with the 2025 Moomba Mojo, a wake boat engineered to redefine your boating experience. Combining state-of-the-art design with exceptional performance, the Moomba Mojo is perfect for both wakeboarding enthusiasts and families seeking fun on the water. Key Features of the Moomba Mojo Innovative Wake Technology: The Moomba Mojo's advanced hull design and AutoWake® system ensure the perfect wake every time. Exceptional Power & Performance: Powered by the impressive Raptor 400 6.2L Engine by Indmar, this boat offers exceptional power and reliability to ensure you have less downtime and more time to make memories on the water. Spacious & Comfortable: With enough seating space for 17 passengers, the Moomba Mojo ensures comfort for both riders and spectators on the boat. Premium Sound System: Moomba delivers an exceptional audio experience on their boats thanks to WetSounds. This boat is equipped with a full WetSounds stereo system, including an amplified subwoofer, amplified cabin speakers, and amplified Rev 10 HD tower speakers. Engineered for Adventure The 2025 Moomba Mojo is not just a boat; it's a statement. With its dynamic performance and innovative wake technology, it's designed to push the boundaries of what a wake boat can do. Whether you're carving the perfect wake or cruising in style, the Moomba Mojo delivers an unforgettable experience. Family Friendly Fun With its spacious layout and comfortable seating, the Moomba Mojo is ideal for family outings. Enjoy the thrill of wake sports or a relaxing day on the water. The easy-to-use controls and safety features ensure a stress-free and enjoyable time for everyone on board. Ready to Make Waves? Experience the thrill of the 2025 Moomba Mojo. Whether you're an avid wakeboarder or just love being on the water, the Moomba Mojo is your ticket to adventure. Send us a message, give us a call, or visit us in store to see this boat in action! financing and delivery available!! Lake Norman, Lake Wylie, Badin, High Rock, Keowee, Hartwell, James, Mtn Island, discount, Indmar, Tillery, Surf, Watersports, wakeboard, georgia, tennessee, south carolina",https://onlyinboards.com/getmedia/e0e7099a-3127-4881-848e-68e9e1919397/2025-moomba-mojo-115963-image0.webp,"https://onlyinboards.com/getmedia/e0e7099a-3127-4881-848e-68e9e1919397/2025-moomba-mojo-115963-image0.webp,https://onlyinboards.com/getmedia/813000cc-4205-418e-8a5f-551941ec81ed/2025-moomba-mojo-115963-image1.webp,https://onlyinboards.com/getmedia/1ba6633d-0e5e-4398-a9e3-7aa2b67722d5/2025-moomba-mojo-115963-image2.webp,https://onlyinboards.com/getmedia/21a96745-d0aa-49d3-bbcd-ce8258ee9577/2025-moomba-mojo-115963-image3.webp,https://onlyinboards.com/getmedia/b17f10aa-8650-4b73-9d84-637051289a0b/2025-moomba-mojo-115963-image4.webp,https://onlyinboards.com/getmedia/12261bd8-95ac-4149-b4a0-4fb672ac8ea8/2025-moomba-mojo-115963-image5.webp,https://onlyinboards.com/getmedia/ccc795ab-9759-4f0e-adcf-ff95a0c7f9f2/2025-moomba-mojo-115963-image6.webp,https://onlyinboards.com/getmedia/c3e6f88f-cee9-4170-8e36-2999e3db9484/2025-moomba-mojo-115963-image7.webp,https://onlyinboards.com/getmedia/c2416ebb-5187-4b68-b8a4-eff8f3003476/2025-moomba-mojo-115963-image8.webp,https://onlyinboards.com/getmedia/648e31c4-7150-4068-89bb-8984e57c5955/2025-moomba-mojo-115963-image9.webp",704.957.0900,info@boatdudedeals.com,2026-04-06T01:32:30.622817+00:00,,,V-drive,,,,,,,
Y,oib-115970,2025 SUPRA SL 450,Boat,available,199999,"$199,999",2025,Supra,SL,22,0,INDMAR 6.2 RAPTOR 450,,,"CORNELIUS , North Carolina, 28031","2025 Supra SL450: Redefining Elegance and Power on the Waters Embark on a Journey of Unmatched Performance and Sophistication The 2025 Supra SL450 emerges as a beacon of luxury and high performance in the boating world. This 23-foot vessel is a masterpiece, meticulously crafted for those who refuse to settle for anything less than extraordinary. Merging top-tier technology with unparalleled design, the Supra SL450 is in a league of its own. Key Features of the Supra SL450 Sleek and Sophisticated Design: The Supra SL450 is a marvel of modern engineering, boasting an aerodynamic and visually stunning profile. Its refined aesthetics ensure it stands out as a symbol of prestige on any waterway. Exceptional Performance: Powered by a robust 410-horsepower engine, the SL450 is built for exhilarating speed and responsive handling. The advanced hull design provides stability and smoothness, offering a seamless experience even in varied water conditions. State-of-the-Art Wake Technology: With cutting-edge wake and surf systems, the SL450 caters to all levels of watersports enthusiasts. Customizable wave settings allow for a tailored wakeboarding or surfing experience, ensuring every adventure is unique. Opulent Interior: Step into luxury with the SL450's plush interior, where comfort meets elegance. High-quality materials and spacious seating create an inviting environment for relaxation and entertainment. Advanced Control System: The helm is equipped with a sophisticated touchscreen interface, offering intuitive control over the boat’s navigation, systems, and entertainment features. It's a perfect blend of technology and convenience. Versatile and Spacious: The SL450 is not just a powerhouse; it's also a social hub, comfortably accommodating up to 17 passengers. It's versatile enough for tranquil cruises and lively watersport activities. Why Choose the 2025 Supra SL450? The Supra SL450 is more than a boat; it's an experience. It appeals to those who desire the finest in maritime luxury, technology, and performance. Whether you're an avid watersports enthusiast or seeking a vessel for leisure and elegance, the SL450 is your definitive choice. Ready to Make Waves? Experience the thrill of the 2025 Supra SL450. Whether you're an avid wakeboarder or just love being on the water, the Supra SL450 is your ticket to adventure. Don't take our word for it - Call us today to schedule an on the water demo and experience the Supra SL's power and performance firsthand! financing and delivery available!! Lake Norman, Lake Wylie, Badin, High Rock, Keowee, Hartwell, James, Mtn Island, discount, Indmar, Tillery, Surf, Watersports, wakeboard, georgia, tennessee, south carolina",https://onlyinboards.com/getmedia/f20dc9e3-591e-4d2b-b2f4-41ee1be41841/2025-supra-sa-115970-image0.webp,"https://onlyinboards.com/getmedia/f20dc9e3-591e-4d2b-b2f4-41ee1be41841/2025-supra-sa-115970-image0.webp,https://onlyinboards.com/getmedia/e0013d93-998c-4280-994f-62f5f15cb189/2025-supra-sa-115970-image1.webp,https://onlyinboards.com/getmedia/48382509-2272-41af-812f-e8c2b8b740ab/2025-supra-sa-115970-image2.webp,https://onlyinboards.com/getmedia/6de21fb5-458c-44cb-bb84-565367e298eb/2025-supra-sa-115970-image3.webp,https://onlyinboards.com/getmedia/585e76de-435f-46aa-906c-4b63f5975582/2025-supra-sa-115970-image4.webp,https://onlyinboards.com/getmedia/ab8b95f6-e204-4c97-8201-a213c96c8db7/2025-supra-sa-115970-image5.webp,https://onlyinboards.com/getmedia/1dc1645e-a7ab-4ad7-a7e8-59d06dc8e7a7/2025-supra-sa-115970-image6.webp,https://onlyinboards.com/getmedia/81d1d2f7-99e4-4bd2-85d5-e472d414e641/2025-supra-sa-115970-image7.webp,https://onlyinboards.com/getmedia/dc738e69-72a3-4b8b-9121-8893363f4027/2025-supra-sa-115970-image8.webp,https://onlyinboards.com/getmedia/2e45becd-b003-43b9-bafe-6de6596931ff/2025-supra-sa-115970-image9.webp",704.957.0900,info@boatdudedeals.com,2026-04-06T01:32:31.240468+00:00,,,V-drive,,,,,,,
Y,oib-120247,2020 MOOMBA MOJO WITH 85 HRS,Boat,available,79999,"$79,999",2020,Moomba,Mojo,23,85,INDMAR 6.2 RAPTOR 400,,,"Mooresville, North Carolina, 28115","Like new 2020 Moomba Mojo (ME). Only 85 hours. Dry dock is stored with regular maintenance. Lots of upgrades. This boat is sleek and ready to enjoy. No Trailer. The 2020 Moomba Mojo is a 23-foot wakeboat designed for high-performance wakeboarding and wakesurfing, featuring a powerful engine, a large ballast system, and crew amenities, including AutoWake and a Flow Surf system. With a hull designed to handle tons of ballast, the Mojo™ sets a massive stage for riders who want to go big. Go Mojo and get a sleek design and a proven ride every time you hit the water. With modern conveniences like a wireless phone charging pad and LED accent lighting throughout, it’s no mistake that the Mojo is always a contender. Wetsounds stereo package Triton racks heater with extendable arms GatorStep flooring and deck GPS Depth Finder custom boat and speaker cover ...and many more. Measurements Dimensions Nominal Length: 23ft Length Overall: 25ft Beam: 8.5ft Tanks Fuel Tanks:1 × 49gal Propulsion Engine Make: Indmar Engine Model: Raptor 6.2L Total Power: 350hp Engine Hours: 85 Engine Type:inboard Fuel Type:gasoline More Details Financing and delivery available!! Lake Norman, Lake Wylie, Badin, High Rock, Keowee, Hartwell, James, Mtn Island, discount, Indmar, Tillery, Surf, Watersports, wakeboard, georgia, tennessee, south carolina Accommodations Premium A3 bimini surf tower with Triton Wake/Surf racks Preminum Wetsounds sound system W/ 10"" Revo Speakers Mechanical Equipment AutoWake w/ MultiSensor Tech Flow 2 Surf system w/ G6 Ballast System Navigation Systems GPS Cruise w/ display ZeroOff Cruise Depth finder Additional Equipment Dual battery set-up w/ charger Heater PTM extended mirror and bracket GatorStep Deck and flooring Custom Cover Safety Equipment",https://onlyinboards.com/getmedia/90a5db63-6da1-46a5-bc81-9338aa9b3d9a/2020-moomba-mojo-120247-image0.webp,"https://onlyinboards.com/getmedia/90a5db63-6da1-46a5-bc81-9338aa9b3d9a/2020-moomba-mojo-120247-image0.webp,https://onlyinboards.com/getmedia/27c570d0-eaf3-4b01-853a-b8e6537d2fb4/2020-moomba-mojo-120247-image1.webp,https://onlyinboards.com/getmedia/fd5438da-e469-4b5b-96ce-f7cf7a68e7d9/2020-moomba-mojo-120247-image2.webp,https://onlyinboards.com/getmedia/789dd0a1-026b-4f94-be08-f1563311d8f5/2020-moomba-mojo-120247-image3.webp,https://onlyinboards.com/getmedia/27455583-33b5-4154-bb6a-1549d4efffbe/2020-moomba-mojo-120247-image4.webp,https://onlyinboards.com/getmedia/49f36293-9679-4f24-be5a-89868bbccb40/2020-moomba-mojo-120247-image5.webp,https://onlyinboards.com/getmedia/4232f78f-442a-4c2a-8f70-2d07b1cb2493/2020-moomba-mojo-120247-image6.webp,https://onlyinboards.com/getmedia/4da7e38f-9232-4ed9-9bee-f12a8646e8f5/2020-moomba-mojo-120247-image7.webp,https://onlyinboards.com/getmedia/d3f497ad-4a16-4724-903f-5f702bcb3df1/2020-moomba-mojo-120247-image8.webp,https://onlyinboards.com/getmedia/cdaf9edb-3922-404e-a2cf-9482a119953b/2020-moomba-mojo-120247-image9.webp",704.957.0900,info@boatdudedeals.com,2026-04-06T01:32:31.887358+00:00,,,V-drive,,,,,,,
Y,oib-121738,LIKE NEW 2024 SUPRA SE 550 LOADED,Boat,available,189999,"$189,999",2024,Supra,SE,23,25,INDMAR Raptor 575 6.2L,,,"Mooresville, North Carolina, 28115","2024 SUPRA SE 550 LIKE NEW WITH 25 HRS https://onlyinboards.com/dealeruserprofile/the-boat-dude-80113 The 2024 Supra SE 550 is a large luxury wake boat featuring an Indmar 6.2L Ford Raptor 550 engine (510 HP), seating for up to 18 people, and extensive tech like the Vision Dash for controlling ballast (up to 10,000 lbs) and surf systems, plus standard DSD audio, adjustable seating, ample storage, and optional stern thrusters for precise handling. Key specs include a 24'6"" length, 102"" beam, 83-gallon fuel capacity, and advanced features like a rear-facing camera and deployable swim step for enhanced watersports performance. Engine & Performance Engine: Indmar 6.2L Ford Raptor 550 Horsepower: 510 hp Ballast: Up to 10,000 lbs (subfloor tanks) Max Capacity: 18 people Dimensions & Weight Length (LOA): 24'6"" (7.47m) Beam: 102"" (8'6"") Max Draft: ~28"" (2'4"") Dry Weight: ~6,800 lbs (varies slightly by source) Fuel Capacity: 83 gallons Key Features Vision Dash: Dual touchscreen control for boat functions, rider profiles, and audio. DSD Audio: Patented system with tower speakers and subwoofers. Stern Thrusters: Optional dual thrusters for easy maneuvering. Flip-Up Transom Seats: Rear-facing lounge with cup holders. Swivel Board Racks: Standard on the tower. Camera System: Rear-facing camera at the transom and tower camera. Comfort: Heated, power-adjustable captain's & passenger seats, wireless charging, USB ports, coolers. Deployable Swim Step: Button-controlled for easy water access. financing and delivery available!! Lake Norman, Lake Wylie, Badin, High Rock, Keowee, Hartwell, James, Mtn Island, discount, Indmar, Tillery, Surf, Watersports, wakeboard, georgia, tennessee, south carolina",https://onlyinboards.com/getmedia/e59516a5-a22c-482c-844b-e0e8c8f9057a/2024-supra-se-121738-image0.webp,"https://onlyinboards.com/getmedia/e59516a5-a22c-482c-844b-e0e8c8f9057a/2024-supra-se-121738-image0.webp,https://onlyinboards.com/getmedia/c805c581-42ff-4d99-ba73-e949f718ea24/2024-supra-se-121738-image1.webp,https://onlyinboards.com/getmedia/33169440-632c-4cfd-853e-c6d3019af286/2024-supra-se-121738-image2.webp,https://onlyinboards.com/getmedia/a87b8cad-7144-49a2-9c4a-60ad739c1cbd/2024-supra-se-121738-image3.webp,https://onlyinboards.com/getmedia/bf282f4b-a4c0-4164-b1a6-d95c65d4a2b7/2024-supra-se-121738-image4.webp,https://onlyinboards.com/getmedia/9a0841d4-6790-4c7b-be29-e78b6c134e4e/2024-supra-se-121738-image5.webp,https://onlyinboards.com/getmedia/31b60021-34d7-4362-9635-805ca3891f86/2024-supra-se-121738-image6.webp,https://onlyinboards.com/getmedia/eaed32bf-130f-4e8c-9656-62eb81198d5d/2024-supra-se-121738-image7.webp,https://onlyinboards.com/getmedia/f0fb5479-bbdc-463f-b57c-82469757432c/2024-supra-se-121738-image8.webp,https://onlyinboards.com/getmedia/a4c08190-ef93-41c4-a84b-db396324094e/2024-supra-se-121738-image9.webp",704.957.0900,info@boatdudedeals.com,2026-04-06T01:32:32.607239+00:00,,,V-drive,,,,,,,
Y,oib-122115,2020 MOOMBA MOJO WITH 315 HRS,Boat,available,72999,"$72,999",2020,Moomba,Mojo,23,315,INDMAR 6.2 RAPTOR 400,,,"CORNELIUS , North Carolina, 28031","2020 Moomba Mojo 6.2L Raptor 400 Wetsounds Upgraded Audio w/ sub Trailer Included Full Boat Cover w/ Platform Cover Upgraded Strapless Triton Board Racks 315 hours 1 owner Just serviced, Well maintained has all service records and all work performed through SouthTown Watersports at correct intervals Everything works perfectly, fully inspected and ready to hit the water!!! financing and delivery available!! Lake Norman, Lake Wylie, Badin, High Rock, Keowee, Hartwell, James, Mtn Island, discount, Indmar, Tillery, Surf, Watersports, wakeboard, Georgia, Tennessee, South Carolina",https://onlyinboards.com/getmedia/0fbc8bc0-0ab7-49b9-b17d-71501bb67e2c/2020-moomba-mojo-122115-image0.webp,"https://onlyinboards.com/getmedia/0fbc8bc0-0ab7-49b9-b17d-71501bb67e2c/2020-moomba-mojo-122115-image0.webp,https://onlyinboards.com/getmedia/1ecd0628-b968-4e26-8a0d-acdd3707ca56/2020-moomba-mojo-122115-image1.webp,https://onlyinboards.com/getmedia/73a0b580-1794-45e7-9b58-82adfd45e8a1/2020-moomba-mojo-122115-image2.webp,https://onlyinboards.com/getmedia/f4049026-0ada-42b4-95c3-5fc715d08837/2020-moomba-mojo-122115-image3.webp,https://onlyinboards.com/getmedia/f6a57f52-7ac4-4c86-93ae-16171f997ae4/2020-moomba-mojo-122115-image4.webp,https://onlyinboards.com/getmedia/0f1ece37-b2d2-4cc8-863a-0cb246a249fa/2020-moomba-mojo-122115-image5.webp,https://onlyinboards.com/getmedia/4bc73330-5188-43eb-8607-370a21d8a823/2020-moomba-mojo-122115-image6.webp,https://onlyinboards.com/getmedia/7e7485f4-a210-41f9-9300-a7e0b59a9f2b/2020-moomba-mojo-122115-image7.webp,https://onlyinboards.com/getmedia/80bcfb66-de77-4091-80d2-a3148ceb6641/2020-moomba-mojo-122115-image8.webp,https://onlyinboards.com/getmedia/b85b8358-d982-48de-8b1c-4d82eba11d90/2020-moomba-mojo-122115-image9.webp",704.957.0900,info@boatdudedeals.com,2026-04-06T01:32:33.276406+00:00,,,V-drive,,,,,,,
Y,oib-126792,2017 SUPRA SA 400,Boat,available,89999,"$89,999",2017,Supra,SA,22,696,INDMAR 6.2 RAPTOR 400,,,"Mooresville, North Carolina, 28115","T he 2017 Supra SA 400 offered by SouthTown Watersports in Charlotte, North Carolina delivers the kind of balance wake athletes and families crave—plenty of punch for serious sessions, with the comfort and style to unwind between sets. Measuring 22.5 feet in length, with an 8.5-foot beam and a 2.3-foot draft, this SA 400 finds the sweet spot between performance precision and all-day usability. Its deep seating arrangement comfortably fits up to 16, giving everyone a front-row experience to the action behind the boat. Performance begins with the 350-horsepower V-drive engine that powers crisp acceleration and steady pull. Supra’s proven hull design partners with oversized upgraded ballast bags, lead bags, and a surf exhaust to fine-tune wakesurf and wakeboard conditions to your liking. Riders can push progression on smooth, predictable waves shaped with the SA’s technology, while passengers enjoy the deep, secure cockpit and high-quality sound from the integrated JL Audio system. The surf exhaust ensures cleaner, quieter sessions with reduced fumes in the surf zone. Below the surface, the SA 400’s hull design works efficiently to blend surf wave height and clean transfer, giving wakeboarders a solid lip and surfers a smooth push. Its V-drive layout creates interior space that feels open yet secure, delivering both lake-day comfort and a competition-ready setup. Attention to balance, noise control, and performance makes this model a standout among 22-foot class inboards—responsive enough for advanced riders, yet forgiving for those learning new tricks. At SouthTown Watersports in Charlotte, the local waters provide the perfect setting to experience what the Supra SA 400 can do. Known for their deep experience in wakeboat performance, the SouthTown team can walk through this 2017 SA’s setup and maintenance details, ensuring it fits your riding style and expectations. Whether you’re dialing in surf settings for long glassy runs or pulling a full crew across your favorite Carolina lake, the SA 400 has the precision, space, and power to make it happen—every time you drop in behind it.",https://onlyinboards.com/getmedia/634bcfde-4537-4bda-8bc2-5f1d9f9b41f8/2017-supra-sa-126792-image0.webp,"https://onlyinboards.com/getmedia/634bcfde-4537-4bda-8bc2-5f1d9f9b41f8/2017-supra-sa-126792-image0.webp,https://onlyinboards.com/getmedia/64540a18-5cde-4317-bc2f-2cd866af2fd1/2017-supra-sa-126792-image1.webp,https://onlyinboards.com/getmedia/b1f4ec43-11c5-42b5-8488-e3cf70642f12/2017-supra-sa-126792-image2.webp,https://onlyinboards.com/getmedia/61c06823-ce9d-492d-b9e4-19abc274ff0b/2017-supra-sa-126792-image3.webp,https://onlyinboards.com/getmedia/e366c93a-82af-4a35-b531-5eae656a389e/2017-supra-sa-126792-image4.webp,https://onlyinboards.com/getmedia/2dff2c50-0a6e-46ea-8c45-912bed5e4fd5/2017-supra-sa-126792-image5.webp,https://onlyinboards.com/getmedia/6eeee419-3d4b-4eef-8e70-baee92eba949/2017-supra-sa-126792-image6.webp,https://onlyinboards.com/getmedia/94d9284b-1549-4eb5-8baa-ce945413b5ac/2017-supra-sa-126792-image7.webp,https://onlyinboards.com/getmedia/68130d9b-8cf6-4fd8-b081-5b0a260bb882/2017-supra-sa-126792-image8.webp,https://onlyinboards.com/getmedia/173acbc8-77b7-43e1-8be8-8cae7ddfd6af/2017-supra-sa-126792-image9.webp",704.957.0900,info@boatdudedeals.com,2026-04-06T01:32:33.857692+00:00,,,V-drive,,,,,,,
